{"canonicalization_version":"artifact-json.v1","config_schema_path":"config.schema.json","defaults_path":"defaults.json","documentation_paths":["README.md"],"environment_refs":[{"kind":"endpoint","name":"TEST_ENDPOINT","required":false}],"files":[{"path":"README.md","role":"documentation","sha256":"sha256:0d9e2bfd03787d4d3ad842ef14be80eca39ee36c4df79cef5774f16fbd9a2fb9","size_bytes":"50"},{"path":"config.schema.json","role":"config_schema","sha256":"sha256:c5a0e86b87dc62fba1def1dd561fa490a6929ee9334e56c24699797254e9f3de","size_bytes":"171"},{"path":"defaults.json","role":"defaults","sha256":"sha256:a050ef06ea542b8fd8781f1e945f9adcd03c7ae5190719e66ba826e2059fce12","size_bytes":"17"},{"path":"plugin.wasm","role":"wasm","sha256":"sha256:93a44bbb96c751218e4c00d479e4c14358122a389acca16205b1e4d0dc5f9476","size_bytes":"8"}],"plugin_name":"offline-demo","plugin_version":"1.0.0","schema_version":"artifact.v1","source":{"build_inputs_digest":"sha256:2947f79a3a73a2f06f43896a835440cf78d28887e4c57d69369ad3861c3c66fb","commit":"1111111111111111111111111111111111111111","dirty_digest":"sha256:e3b0c44298fc1c149afbf4c8996fb92427ae41e4649b934ca495991b7852b855","kind":"local_build","repo":"https://example.invalid/fixture","verification":"verified"},"wasm_path":"plugin.wasm"}